id,tweet
3556,gaskiya kinnuna jajircewarki irinki muke nema a nigeria
3557,allah sarki uwata allah gina miki gida a chikin aljannatul fiddaus
3558,inna lillahy    allah ya kawo mana saukin wannan mummunar yanayi
3559,toh pha allah yasa kada suyi wuf da kudin
3560,allah gaka ga sunan  allah ka daukarwa bayin ka raunana fansa  hakika allah isra ila ba sufi karfin ka ba
3561,talaka ya waye ynxuu  karyake kallon kowa fah
3562,wan nan gaskiya ne allah ya kawo sauki
3563,innalillahi wa inna ilaihi raji un  allah ubangiji ya gafarta masu  ya kyautata tamu
3564,gaskiya shugaban kasa malam yayi kokari allah yasaka mai da alkhairi saura minimum wage  yanzu kuma yarage ga police   na nigeria suji tsoron allah sudaina ansar chin hanchi
3565,to ai dama mu zaman lafiya muke so
3566,rahama simply you have to ask for forgiveness from almighty allah  s w a   we also looking from forgiveness from our almighty god  allah ya yafe mana baki guda       amma wlh kin bani tausayi sos
3567,hmhmhm    kaih jama a aji tsoron allah
3568,zaki iya samon namujin kowari  mai tsoron alla  mai hankali ta bangaren moamalasa tare da in mata  mai tsapta akowane lokaci  mai mormoshi akowane lokaci saboda mormoshi yakan tsanya zocia fari
3569,nothing beats and ifthar with a flavored maltina    above all  sharing with family barkanmu da shan ruwa   ifthar mubarouk
3570,amen ya allah allah yabaku zaman lpy zakayi wuff da zee fretty
3571,nima insha allahu idan nasamu 10 000 000 kyauta asatinnan to nayi alqawarin zan bada 2 000 000 aci da hakuri
3572,allah ubangiji ka kyauta ta namu karshen kowa da kalar nasa ajalin ita kuma kalar nata kenan allah kasa mudache amen
3573,no wonder your the best dancer in kannywood  ashe deh kallon bollywood neh sirrin    it took me 14days of practice b4 i learn rariya
3574,allah ya sa muga karshen wannan masifa   lafiya
3575,thanks u malami
3576,allah ya kyauta rayuwa kenan  allah ya kawo yanda za aye allah yasamudace
3577,mudai addu ar mu akullum itace allah bashi ikon gyarawa
3578,allah ya tsaremu ya karemu da tsafi koh wane iri ne da kuma sharrin mutum koh aljani
3579,bana anyi abin kirki
3580,nan yafi auki ai allah yasa yatafi kenan
3581,alhamdulillahi  tabbas gone zanyi sallah allah ya karba mana ba wani sarkin sokoto da zan tsaya jira
3582,kin ganki sae kace wata amaryah
3583,godiya muke director
3584,muna godiya mu ma
3585,kawai nake san gani allah
3586,kasan qauna ta da alkama kasan duk abinda annabi yake so ina sonsa   eh                 duk abinda annabi yake so ina sonsa                 allah sarki  inshaallahu kana tare da qaunar annabi saw
3587,saura namu  nigeria  mai ikirarin gaskiya
3588,salam alaykum bbchausa dafatan kuna lafiya tanbayata gareshi itace me yasa yana kan daukan sunaye daban daban yana waka dashi amma bai tapa daukan suna yan biyu ma ana hasana da husaina yayi waka
3589,a gaskiya yau saku ya isah yarda muke so allah yakara fahimta aminu saira amman dan allah ka isar min da sakuna ga mamar guntu wato mina  allah yakara mata sanin labarina
3590,se uban abba namu    aikinka yn kyau
3591,yana mana dadi ma mu  indai laila zata ci gaba d jika mahmud
3592,allah y tabbatar mai da alkhairi
3593,allah ya daukaka tv arewa24
3594,amso shin takaddunku                 very education indeed
3595,allah ka cigaba da ciyar damu halal ya allah babban director
3596,allah yasa muyi sallar juma a lafiya sarki mai f k d
3597,barka da sallah
3598,oh    ahbeg make we gist    dama ya dade da ina so mu yi tadi
3599,allah sarki   allah yajikansa darahama
3600,ina kusa da gobe fah aimin guri    cant wait
3601,allah yakara shekaru masu albarka amin
3602,mu yan zamu yi biki in sha allah  3   0 united basu shirya ba  up the reds
3603,kin hadu yan mata
3604,topaa   allah ya jikan musulmi
3605,innalillahi wa ina ilaihim raji u     subhanailla   ya allah karka kawo mana wannan bala i da wannan mutum yake kawo mn shi ya allah ba zamu iya ba wllh allah ka iya mana
3606,my best aunty rahama
3607,allah ya sauwaka   wannan mulki na buhari shi ake kira                 jarabtar so
3608,allah ya ganache dake kidawo hanya madedeciya that s the only prayer da zamu miki
3609,allah sarki  allah ya yafe miki rahama
3610,a a wallahi akwai masu so dan kuwa sunce abokiyar zama ce   amma yakamata muji ke kina so ko kuwa
3611,allah ya qara basira malam       labarinaseries for me is the best hausa series to date  fatan alkhairi  aminusaira
3612,yasalaaaam      ubangiji allah yasa hakan shine mafin alkairy
3613,allah ya baka ikon yan hakan
3614,allah ubangiji ya karo alkhairi da albarka acikin rayuwar auran ka yasa ku dade tare har karshen rayuwa
3615,allah yayiwa ganduje albarka
3616,allah subhanahu wata la yabayyanashi cikin aminci
3617,kaga mutuniyar kirki yar albarka
3618,allah kajin su kuma allah yamasu rahama sukuma azzaluman ya allah kasan su kuma kasan ko suwaye allah kasan yadda suke kashe muminanai adoron kasa allah gasunan kamasu suyyar kosai da azabar ka
3619,gidan miji shine babban kyawon kowace mace a duniya
3620,gaskiya abun akwai kayatarwa a ciki
3621,subhanallah        allah ka yafe mana  ka kawo mana qarshan wanan abu
3622,allah dai ya kaimu daddy
3623,su ina ruwansu allah   ya tsayar kansu
3624,allah kasa ya cika alkawarin daya daukarwa mutanen
3625,allah sarki kasata najeriya 18k
3626,allah ya taimaka amma nikam ina             bazeyihu ba
3627,bakomai akwai allah mai girma da daukaka yanaji yana gani  shi zai mana maganin su insha allah
3628,allah shi karba addu a mu
3629,baka da matsala babban darakta    and congrats on a job well done
3630,good   oga zango
3631,allah ya biya musu bukatun su na boye dana bayyane  allah ya basu ladan ayyukan su ya sanya musu albarka
3632,ya ubangiji  ka gafatarwa wannan bawa naka
3633,hhhhh  allah ya qara daukaka
3634,banda tacewa    ku cigaba da addu a  hr bh da bandits su shiryu
3635,wannan rayuwa    hmmmmmm  wai me sls yayiwa ganduje ne  allah sarki bawan allah  ido kawai ka zuba ka hanashi bacci inada kayi magana  ya salam  allah ya bar mana kai sls    ameen   i
3636,baki da matsala
3637,allah ya karawa mallam lafiya  gaskiya ne zaman lafiya yafi komai allah ubangiji yakara mana zaman lafiya da karuwar arziki
3638,allahumma agafirli zunubana
3639,allah sarki duniya rijf
3640,kiji tsoron allah dai   kuma muna addu ah allah y shirya ki shirin adnin musulunci
3641,innalillahi wainna ilaihir raji un          ya allah forgive us and bring peace in our country amin  zabarmarimassacre
3642,da muguwar rawa  gwamma qin tashi
3643,wallahi ka fadi tsantsar gaskiya  amma inna mafita
3644,allah yasa mu dace        everything will be ok inshallah  allah ya kiyaye gabah
3645,innalillahi wa inna allaehim raju um allah yakawomuna karshen wannan masifan ameen
3646,really proud of u bro  allah yamana jagora
3647,allah ya karawa malam lafiya da duk wanda yake dauke da wannan cutar ta covid19    the captain is back
3648,allahumma inni as alukal afwa wal afiyata fid dunya wal akhira allahuma inni as alukal jannata wa a udhubika min an nar
3649,allah shi taimka dayake abun ba a makka bane aje ayi lafiya
3650,allah yaqara girma king   ramoos
3651,allah ya basu lafiya  ya kai musu agajinsa da taimakon sa
3652,allah biya sarki ubangiji allah kara daukaka
3653,allah ya karawa rayuwa albarka dan girman nabiyul rahmati     ramadankareem
3654,allah ya saka mishi da gidan aljanna  he s the best we ever had
3655,allah yakikaye gaba su kuma allah yah jikansu
3656,allah yasa tallafin da japan zata ma kasashen africa ya isa hannun wanda akayi domin su ko kuma mugani akasa ameen
3657,sami     baze rage shi da komi ba   allah dai shi cika masa gurin sa amin
3658,braka da sallah big boss  hausa star
3659,kai amma likitocin yan india sun iya aiki har an gama ya dawo gida nigeria
3660,sai oga gudaji samasa guduma kawai awuce wurin
3661,kai dama haka kike da kyau
3662,allah yasakawa da malam da gidan aljannan
3663,uhmm bana fa babu laifi yana motsawa kamar bulgari
3664,kowa naganin nasara ga club dinsa
3665,masha allah sai godiya
3666,hegu allah ya maku mugun kyau
3667,congratulation fc bayern munich ix ur day   where ix rahama sadau how market  kadaki manta watarana a psg yau kuma a bayern munich
3668,allah yakare al umma baki daya
3669,aunty fati kenan     godiya muke
3670,you are welcome yallabai
3671,allah ya yafe musu
3672,anytime oga  sauran walima
3673,allah ubangiji ya haskaka kabarinsa
3674,allah ya jikanta da rahamarsa
3675,allah ya shiga cikin lamuran mu
3676,subbuhanallah  ya allah ka kawo mana karshen wanan masifar a kasarmu nigeria
3677,allah yaji  anku da rahama amin
3678,alhamdulillah  allah ya kara kiyaye na gaba
3679,gaskiya wannan shiri yana kayatar da masu kallo da sauraro
3680,a a  ayi hukunci dai dai da shari ar muslunci  shine adalci  ba hukunci cikin fushi ba
3681,muma muna so
3682,my god that film is nice wlh  i think the time keeper should just ring the bell  antashi wlh babu wani film nanda 5 years to come dazai breaking record dinshi  acigaba da dagewa muna yinki
3683,gaskiya this movie is very interested dan yanzu ma shi nake kallo
3684,nifa da zau rahama sadau tace sai ni da sai na ruba ruwa akasa nayi drink nasa
3685,sharifi jikan ma aiki allah ya bamu albarkacin ka
3686,allah ya bamu zaman lapia a wannan kasa tamu ta   da kuma arziki me dorewa mae albarka
3687,allah ya shiryaka   ya kuma dawo d hankalinka kan talakawan da suka baka yancinsu suka zageka dan ganin cewa zakayi adalci amma sam baka wani kokari aradu   happy birthday baba manjo
3688,allah ya kara mata matsayi ma
3689,allah sarki allah yabaki lapiya
3690,wannan hk yake ramatuuuu
3691,muna godiya da sosai akan kokarinka gmb amman yanxun lokachi yayi da muke bukatar adalchi da zage damtse akan wannan taadanchin dayake faruwa svd haka kaji tsoron allah ka mike tsaye domin maganc
3692,allah ubangiji ya ji qansu gabadaya ya kuma yi musu rahma     sun manta da za a je lahira dukkan rai zai dan dani mutuwa               zabarmarimassacre  sacktheservicechiefs
3693,jinjina ta musamman
3694,allah ya kawo karshen wannan tashin hankali wlh gaba yan nijeriya wasun mu bama kyautawa yanz menen amfanin tashin hankali da zubar da jini     kaico allah ya shiryemu
3695,allah ya jikan rabilu miss ibro   amin
3696,rabbana laa taj alna fitnatallillazina amanu
3697,to ubangiji yaimanq maganin su sannan muna kira ga gomnati pls n pls takara tsaurara tsaro
3698,kaje dashi dai mudai sai munyi insha allah
3699,abu yayi kyau sosai
3700,allah ya masa rahama    adalci da gsky
3701,muna adu ar allah ya ara dafama wa yanda keson gaskiya    wa yanda keson suyi wasa dahankalin mu dakuma rayuwar mu  yah allah ka                 taabad                 dasu
3702,wane mutum inji mutuwa  kai dai ka gode wa allah ka kama gabanka   ama babu dabarar ka ko guda daya   allab ya ga daman azurta ka shikenan  raguwar kuma  sai labari
3703,mudai muna alfari da qungiyan sannan mu muna kishin aljihun mune saboda a samu zaman aure mai nagarta babu qarya a cikin ta gunda tun awaje su saba da irin wannan bani baran bayar bah amman zan d
3704,ya subhanallah    ya allah ya kawo mana qarshen wannan anobar kafin azumin watan ramadan
3705,insha allah za ayi lfy kuma za a gama lfy da yardar allah
3706,allah ya jiqansa da rahama ameen thumma ameen
3707,yana sane da irin qoqarinda yakewa kasarsa da al ummarsa  tell him muna godiya  allah ya bar zumunci
3708,allah ya jaddada rahama kabarinka sir
3709,allah ya albarkaci rayuwa  amin  happy birthday in advance  cheers
3710,a cikin kawayan amarya nan a duba daya nayi wuff da ita
3711,gogan yayi tunani shi ake ma tafi harda wani thank you
3712,cire rahama a sabga kam ai akwai matsala   allah ka sani muna son rahama  ka durmiya mu a cikinta
3713,a gaskiya yana da kyau gwamnati ta kara kula da ire iren wadannan gidaje domin amaimakon su kasance wurin shiryar da kangararru to sai abin ya canja launi  muna fatan gwamnati zata kara kokari
3714,hbd allah ya karo shekaru masu albarka
3715,allah ka kawo mana karshen wanan jarrabawan  ka karemu daga sharrin wadan nan mugayen mutanen nan  allah ka bayyana wanda suka kama  kuma ka tona musu asiri duniya da lahira  ameeeeeeen
3716,allah ka karyawa gwarunzabi fuffuki kuwa ya huta tunda har ya kai wajin corona
3717,zamu sha biki wollah   zata pashe
3718,wlh abin tausayi inde kina da gaskiya ubangiji ya fitar da ke in kuma bahaka bane ubangiji ya karbi tubanki
3719,chab  gaskiyya ka tsallake da kyar  kuma abin godiyya shine duk inda kazo zaka shiga matsala sai allah ya kawo wanda zai fada maka  allah mai girma
3720,wasu kasashen naduniya sun mamakin irin abubuwandake faraway awannan kasar tamu ammamu al amuranmu muke ba abundaya damemu allah ya suttura
3721,congratulations rahama more win
3722,to me presidor shine labarina  i am waiting for him since  aiki na kyau malan aminu
3723,fadan da bbu ruwanka ddin kallo mu yan kaduna sai kallo muna dariya
3724,gyada mai sihiri a bara aga biyu a murza aga hudu a tauna aji gardi
3725,wannan ranar ni mummunar ranace gareni saboda mahaifiyata ta rasu bayan inada wata 6 da haihuwa a duniya ban ma santa da fuska ba allah dai yaji qanta da rahama yasa aljanna ce makomarta
3726,allahumah sale wa sallim alah mohammad   allah yasa mukasance da annabi mohammad    s a w  a ranar gobe alkiyama
3727,don allah kuyi hakuri  domin ku  yan uwan juna ne
3728,allah kiyaye nagaba yakuma sanya kishi da tausayin juna a zukatar mu
3729,alamu na nuna haka   duk da dai hausawa na cewa hannu daya   baya daukar jinka  allah swt ya kyauta
3730,hmmm allah ya kyauta dai kawai
3731,dake da ita bakuda bambanci  gwamma ma rigarta sau dubu akan taki   wlh muji tsoron allah mu dinga tuna mutuwa da kwanciar qabari  rayuwar yahudawa ta daina rudar mu  allah ya shirya mu muduka
3732,makirai every where you go  allah ka yi mana tsari da irin wa an nan bayin naka masu jefa mutane ciki u uba su dawo suna yi masu da in baki
3733,allah ya kawo karshen matsalar da libya ke ciki dama sauran kasashen africa amin
3734,allah mun tuba  allah ka yafe mana
3735,masha allah    abu yayi kyau  allah ya yawaita irinsu
3736,gaskiya ne ale abba
3737,allah ya kaimu muji daga bakin boss
3738,end of the film      by md ukasha saira oga alla yakara lafiya da basira  nafara kallon hausa movie ne akan shirin labarina
3739,allah ya shiryi masu yada jita jita   ku kuma allah ya qara kareku ya tsaremana ku   ameen
3740,ina rokon allah daya axurtamu da yanbiyu kyautar allah    allah yabani inaso
3741,allah ka zaunar da kasar mu lapiya
3742,mallam aminu saira bawai saukar shuwagabanni bane matsalar  kawai ya kamata suji tsoron allah ne su sauke nauyin dake kansu kafin suma lokacin amsa kiran ubangiji ya musu
3743,allah ubangiji mai rahma da jinqan bayinsa da tausayinsu ka kare wannan baiwa taka da sauran duk wani dan adam dole bala i yayi yawa  astagfirullah wa atubu ilaika ya allah
3744,kano su sukafi kowa zaben buhari a 2015 haka ma a zaben 2019 amma duk da haka lissafin ya ragu sosai saboda buhari ya manta da irin soyayar da yan nigeria suka nuna masa mussaman ma yan kano  all
3745,barka da sallah my heroine
3746,muna godiya daraktan daraktoci
3747,ba dqmuwar mu bane hakan kawai dqmuwar mu yan uwanmu su kubuta fatan allah ya dawo dasu gida lafiya   alfarmar annabi muhammad s a w
3748,wato kasamu alheri ko
3749,toh allah ya kyauta vaku hidda zakka ne
3750,gsky shirin y kara armashi wlh
3751,mu nigeria insha allah mu zamu dauki cupin
3752,allah yasakamana musulman duniya yakuma jikan malan da rqhama yakare kare musullinci da musulmai masu naiman ganin bayanshi allah kayi mana maganinsu
3753,sulhu alkhairi ne     na goyi baya ayi
3754,wannan magana tayi dai dai baba ana baka kasa hannu muna goyan baya wallahi
3755,dan duk wacce ko wanda bai bada hadin kai ba harkar nan  kar a kara bashi script     morel  your efforts are appreciated wlh
3756,to allah yafiddashi ruwa
3757,yasin kin hadu   am in love
3758,toh masha allah yayi daidai allah yakaimu muma
3759,gsky ne mai gd
3760,ba wani abu haka mulki ya ke allah ya ba shi ikon sauke nauyin da ya dauka amen
3761,yayikyau     up baba buhari
3762,allah ya baka mulkin nigeria da alheri ka basu mamaki baba na
3763,ameeeen rahama baki taba birgeni irin na yau ba wallahi kuwa
3764,hmmmm nigeria jaga jaga   allah ya yaye musu
3765,sure  na icon ce mai bawa kowa joy
3766,gaba salamun baya salamun  dattijon arziki jagoran talakawan    uban talkawan nigeria    kaci jiya kaci yau zakaci gobe da yaddar allah  ubangiji allah yadawo mana dakai lafiya
3767,congratulations yanzu angirmi nollywood kenan
3768,nidai muna zaune lfya da budurwata
3769,in sha allah baba     buharist
3770,allah ya taimake su ya kare mana su daga sharrin masu sharri
3771,baki taba birgeni ba wlh seyau
3772,alhamdulillah allah yataimakemu yasa mudace cikin bayinsa kyantattu kuma yabamu zaman lafiyah da abinda lafiya zataci albarkan wannan wata mai albarkah ameen
3773,allah kara ma baba lafia da kamanta adalcii tsakankanin yan nigeria
3774,baba manjo   aikin ka na kyau my people please stay safe corona virus is real  aciga ba da wanke hanu   stay safe   and don t forget always wear your face mask
3775,allah sarki kada ki damu ai mun san asiri akayi miki duk abun da kikeyi ba yin kanki bane ba
3776,hhhhhh yasin kina burgeni sadau      i love you
3777,the only hausa actress   sauran duk shiru ne
3778,allah yakawo mana saukin wannan kishi namata haba dai mata
3779,ai a inda ake musulunci kawai nan akeyi wani kawai yana amsa sunan musuluncinne allah ysa mu mutu da imani ameen
3780,allah ya mana mai keu gimbiya  fatan alheri
3781,yana da kyau shugaba ya rinqa nuna jarumta da jajircewa ba wai ko yaushe suna nuna hali na rauni  gazawa da jin tsoro ba ta hanyar kiran yin sulhu sau ba adadi da mutanen da ba su san al awari ba
3782,wato dai wannan mashekiyar itama sai an sheke ta  to ai hike nan allah ya jikan ta ita da mijin ta
3783,uhmm  allah sa mudace
3784,ameen allah ubangiji ya karbi ibadu
3785,obama kayi rawar gani sosai gaskia duniya za ta yi reshin shugaba nagari  bamu san ya amurka zata kasance ba idon ka sauka daga mulki
3786,ni wlhi kunya ma nike ji yanzu idan ina ganin buhari a matsayin shugaban kasa wai kuma dan jaha ta   allah yaji kan yar adua
3787,happy ramadan kareem aunty rahama
3788,allah ya karbi wannan ibada da al ummar borno zasu yi  allah ya kawo zaman lafiya a wannan yanki  albarkacin annabi da alqur ani
3789,to ke ki kokari ki fara siya
3790,to sai a  ara zage damtse wajen baiwa  annenmu kariya
3791,nima ina mika murnar birthday ga sister halima    happy birthday
3792,ansha kyau fr
3793,allah yabada saa yamana maganin wannan fitina
3794,innalillahi wainna ilahirraj un
3795,amma kaikuma malam aminu irin wannan ai da wuri ake sanarwa muna a gaban tv sai kawaii ganin mukayi komai yakoma baya allah ya kyawta
3796,ina yinki hajiya
3797,kokefa  sak musulma kawaii wlh
3798,allah yasa ka fara tausayin talakawan ka sanadiyar hakan musamma mutanan maiduguri da suke rasa iyalan su sanadiyar boko haram
3799,duk kyawon mace oneday she s a matrex of somebody
3800,naga alama yanxu dai kudan jin nigeria sunfi sont fiye da arewa cin nigeria     nassan wasu dayawa zasu kira wannan ci gaba koh  congratulations
3801,bilkisu mai gadon xinare
3802,inayiki dear  wllhy allah yakaramai nisan kwana da lfya
3803,gaskiya lamiraj yayi kyau sosai kaman da gaske  sbd allah ya nuna ishara agun masu son suyima allah wayau da shishshigi  memakon ajira ikon allah
3804,menene kuwa in ba soyayya ba
3805,allah sarki talakan nigeria    ba abinda zamuce sai dai allah yayi mana sakayya  albarkacin wannan wata na ramadan allah ubangiji ya kawo mana karshen wannan musifa     allah ya isa bazamu yafeba
3806,well done aunty rahama
3807,allah yasaka mai da alkairi
3808,aikin ka na kyau  allah ya kara basira da daukaka allah ya kuma kara tsare ka da taimakonsa
3809,toh fa   ke dai kullum kyau kike qarawa  gsky ubangiji ya lamunce maki
3810,kafi su gaskiya baba
3811,lallae kam soyayya gamon jini
3812,allah ya tsayar haka bijahi maulatii sayyada fadeemah alaihas salatu wassalam
3813,allah ya karbe aikin malam
3814,ameen sadau  ina hoton sallar
3815,gsky ne   allah kara daukaka
3816,allah yazaba mana mafi alkairi dan hasken manzon allah
3817,wslm yar gari
3818,gsky yallabai ba abun fada dan wlh yabada chitta sosai barama rukkaya kam bata fada dan wlh tabiyawa mai sauraro hakin sa gsky na jinjina mata
3819,allahyakara kai haske kabarinka
3820,manchester united ce kawai zata iya yin haka ta kwana lfy
3821,dariyar ka alkhairin ka tsoho
3822,allah ubangiji ya sada shi da aikinsa  ya kuma hadasu da bulus a gidan gaskiya
3823,allah kayi muna maganin wadannan mutane
3824,allah ya sa dai bada manjo kuke ba
3825,beautiful allah yaqara basira dun yarasulullah
3826,hakan yayi daidai saboda yanayin jarabawa da muka tsinci kanmu  allah yayi jagora
3827,same dear sarauniyar kannywood
3828,babu ko daya kawai arakasu da addu a allah ya saisaita su
3829,yanzu duk wannan a n9b kacal  anya ba a aljihunka za ka cika ba   ina addu ar allah ya cigaba da ba ka ikon farantawa al umma da kudinka  allah kuma ya qara baka ikon farantawa gwaggon kanawa
3830,that s why i like u so much bazan futar da rai ba watarana zamu hadu face to face in sha allahu
3831,inna lillahi wa inna lillahi raji un     shugabanni kuji tsoron allah
3832,allah yakara kawowa sauki amin summa amin
3833,i travel to kano specifically because of the filmand i watch the film mati a zazzau and the film is very interesting and very educative keep the good work sai ma kindawo gida xan baki lbr yadda a
3834,hakan yayi daidai wlh
3835,ya ubangiji allah ka kawo mana karshen wannan musibar
3836,ke kuma ki rika hkr in an takalekii kinji
3837,allah ubangiji yasa mudace ameen ya  allah
3838,zan ce masa  allah ya kara maka nisan kwana  ya kare mana kai   nigeria    ta na kan hanyar gyaruwa
3839,yayi daidai  allah ya dawo mana dashi lapia  magulmata
3840,allah ka kawomana qarshen wannan bala in
3841,tohm allah yajikanka da rahman boss          but sha we will keep praying for u sir insha allah ur final home is aljannatul firdausi
3842,abun fa da ban tsoro allah ya sa a gano su cikin aminci allah ya tsare su daga dukkan sharri amin
3843,rahama sadau ina yinka 100
3844,i don t know your take on this but seriously shigan nan yafi maki kyau
3845,gaskiya wana soyaya ta wow
3846,innalillahi wa inna ilaihirraj un  ya kamata hankalin me yankan kaba ya koma kan runa  mutane su gyara halayya da dabu u su kuma yawaita                  astagfirullah wa atubu ilaih
3847,to allah yabasu nasara akan azzalumai yatemakesu dan tsarkin mulkinka shi allah
3848,ina taya dan uwammu ko nace babammu elrufai nasara
3849,meanwhile our governor  lolo  is busy dancing with yanmata a wajen party     allah ya saka muna
3850,insha allah buhari zai fadi atiku ne me nasara
3851,allah ya gafarta maka allah ya sa karshen wahalar kenan
3852,allah yasa de albasa tayin halin ruwa
3853,gaskia kur allah ya maimata mana kalan wannan salan rahma
3854,allah yasaukar mana da albarkanshi a fadin nigeria kamar yadda ya saukar da wannan ruwan
3855,amin y hayyu y qayyum  aunty idan na fara nawa zan iya zuwa shan ruwa gurinke   say something
3856,to allah yasa mai dorewa ce matsayar
3857,aa gaskiya ya fada mai
3858,aiki yana kyau  acigaba da dunkule hannu  here we go
3859,ya allah ka gafarta masa     kuma allah kataimaka mana tun duniyar nan duk mai hannu wurin kisansa yaa allah ka tinamasu asiri   ka wula antasu birahmatika
3860,allah kawo mata tagari ya shige daga ciki
3861,love u rahama sadau
3862,allah yataimaka megida  one love
3863,ta gwada wa manutd kwanji
3864,kwamitin masu azumtar watan kuma sun ce tabbas zaa ganshi ranar talata in allah ya yadda
3865,gaskiya kinyi kyau sosai wallahi barakallah masha allah  allah ya qara daukaka da nisan kwana ameen
3866,muna rokon allah yatona asirin dukkanin mutanen dasuke haddasa wannan abubuwa a arewacin nigeria  allah kada yabasu zaman lafiya allah yarusasu da dukkanin masu taimaka musua allah ya isa
3867,allah ya saka da alkhairi baba buhari  daman halinsane kyauta
3868,ya allaah ka shirya mana shugabannin mu   wasu wajen warwaso seh su mutu  allaah yasa ku canxa wannan tunani naku    dan adam
3869,allah yafumo hinnumo feunanmo hokkamo sare aljanna fiddausi
3870,nagode hwa rahamatu   kwallahiya
3871,amatsayina na ina daya daga cikin samarin arewa  ina goyan bayan sai baba
3872,allah ka samu a cikinsu amin dai
3873,allah ya sawaka  talakan nigeria dai yaga takan sa
3874,haka yake allah karda na nuna ma yan najeriya wanda za ace gwanda bihari
3875,innalillahi wa innailaihi rajuun wannan wace irin mashifa ce yau ayi nan gobe ayi can allah yakawo mana dauki
3876,allah sa yahuta
3877,wannan irin da hula  sai ahankali  allah ya nuna mana
3878,kai wannan kasa tamu allah ya kyauta baku ina warware matsalar masu lefi ba amman kun ina kama masu exam
3879,allah yasa muga alkaire game da tattaunawar nan
3880,kidai fadi gaskiya banda son kai
3881,allah kasa su a duhu suma
3882,me precious queen don t get angry  turo account number dinki inyi saka ki farinciki
3883,aikinku yana kyau dss  kun tabbatar min cewa kuna aiki nagartacce  duk wanda baiji bariba yaji hoho
3884,in mutuwa su ce alheri  allah ya jiqan su
3885,allah yabasu sa a kare musulunci da musulmi baki dai dan darajar annabi s a w
3886,idan yaso ko yanxu neh maha ya  ara  mu dai fatan mu shine  allah ya bamu abin siye
3887,wallahi kina   mutuniyarnan i hope to meet you 1 day  saboda ina masifar sonki
3888,masha allah  may blessyour efforts  mutumika was about to convincing me fa
3889,woww lol harda rahma ashe amma wanda kika sawa wannan sunan yaji dadinsa not bad name
3890,at the whole africa    kai ina tayata murna wallah allah ya qara basira
3891,innalillahi wa inna ilaihi raju un  ya allah ka kawo mana karshen wannan masifan ya rabbi
3892,innalilahi wainnailaihirraji un  allah ya kare shi ya bashi lafiya ya kiyayi gaba
3893,allah ya taimaka my boss
3894,allah sarki sudan suma zasu shiga sahun libya allah yajikanku sudan
3895,gsky abun da mamki shekara 30 ba wasa bace kuma gashi tsaftsaf abinda sa
3896,ayshikenan  allah ya fito da miji nagari
