id,tweet
1093,ba abinda suka iya love sai oyinbo wlh wanan shi ake kira calfonian love
1094,amin amin  i love you rahama my baby
1095,my luv  you luk gojiyos      idan bake ba sai rijiya gaba 1000k
1096,allah sarki allah kai mana tsari da talauci
1097,hhhm allah yasa mu dace duniya da lahira
1098,muma mun karrama wanda yayi filliyar a zukatan mu
1099,tayi kokari matuka  allah ya mata jagora
1100,allah ya sa ku ganshi
1101,allah ya ganar damu
1102,kano ta dabo ci gari kodame kazo anfika  wannan ma wata nasararce
1103,allah bata lpy  yakarae mu bakidaya
1104,wannan maganar haka take babu kokonto acikinta
1105,allah kara basira fitaccen darakta
1106,alhamdulillah  masha allah  muna mika godiya ga yan uwa da abokan arziki  wanda suka taimaka akan wannan al amari da ya faru  allah ya saka da alkhairi  allah yabar zumunci
1107,llah yasa kaffara ne kuma kibar kuka   ki lizamchi istigifari
1108,allah ya fito damu
1109,nice one mai gida
1110,masha allah haka akeson hadin kai akomai aringa taya juna kokari
1111,ameen sanyin zuciya ta
1112,allah shi tsare mu baki daya amin
1113,true fact yar uwa
1114,allahu akbar allah yasa muna da rabo muma albarkan annabi saw
1115,ameeen ameeen ya rahman  nagode
1116,wannann yarinyar tayiphaa wayasan gdansu yarakani xancee plxx
1117,allah ya dada kare mu baki daya aameen
1118,allah yasa muma nigeria sai lahadin
1119,allah yaji qanshi da rahama
1120,allah ya kawo mana karshen wannan masifun ameen
1121,allah yajikan takawa
1122,toh  allah shi sauwaka
1123,i like ur beauty and extraordinary performance in  uziri gaskiya ina kaunarki dayawa kina burgeni aduk film dinki   love u
1124,to allah ya kawo wa al ummar musulmi daidaito akan abinda suka sa a
1125,hmm dama ai wannan al amarin a fili yake                   da dan gari  akan ci gari                  allah ya kawo mana mafita a kasarmu dama duniya baki daya  amin
1126,allah ya ara  aukaka masuson bin dokokn addinin muslunci    shikuma wannan mutumin allah yasa hukuncin da akayimasa yazama rahama agareshi a gobe  iyama
1127,me yasa komai kukayi yake kyau ma mutane ne
1128,hhhh kai with babu gwamnan da yake burgeni kuma yake bani dariya kamar elrufa i    killace kansa yana da kyau
1129,allah ya sa muna ciki
1130,mashaallah allah yakara jagoranci
1131,dan allah dan annabi ki nemo miji kiyi aure
1132,i swear zahra made the right decision by dumping this man     whaaaat  wallahi aji tsoron allah dai
1133,allah yasa muga wurin nan da idon mu
1134,rahama sadau    love you so much from ghana aka tatuma
1135,aiki yayi kyau ai film ya dauku
1136,kaga masu to da gske badawasa ba  kuma ba masu yaudarar mutane zamu gyara ba   ubangiji allah ya dafa masa
1137,anyi walkiya kinga kowa dan allah kikiyaye allah ya tsare nagaba
1138,an gaida yawale
1139,the king   of kannywood martaban kane allah shi kara daukaka and i love dey movie mansoor
1140,ya allah   allah yabashi lfy da duk kan mararsa lfy baki daya
1141,allah ya kara lfy da nasara mai girma gwamna
1142,well done aunty rahama
1143,allah ya kare ki da mahassada   pepper dem gang
1144,soubhan allah allah ya gafarta mata
1145,tunda sarki mai daraja yayi mana bayani   toh munji  mun yarda  mun amince
1146,yayi ango allah ya kara lfy
1147,toh fa yayi daidai allah ya taimaka namu kalo
1148,allah ya taimaku sarki
1149,welcome back gaskiya an iya rawa
1150,good turanci  please  mai miki wannan rubutun a bashi aikin translating subtitles din all hausa films
1151,gwani abdullahi umar ganduje
1152,kina birgeni at times    haha
1153,allah y kawo mana qarshen ku kuma
1154,allah ya kara warwasa ta  mu warwashe
1155,sky is ur starting point kici gaba da    yar sadau
1156,dadi kashe ni tsula da ahalinsa suna qasa
1157,allah ya ka e fitina yakawo  azantar  aki
1158,haka yake best director
1159,gaskia my model  rariya is better than can even compare them
1160,yes confirm rahama maganar ki dutse governor mllm nasir elrufai is lead for example     proudly kaduna s  crockcity
1161,hakan yayi  se kuma a nemo yariman bakura ya tallafa abin yayi karko  wanan shi ake kira tsari cikin tsari
1162,allah sarki   ashe dai yanasan sarauta
1163,ubangiji allah muke roko da karya barsu da iyawarsu ya taimakemu da taimakonshi sukuma yabasu juriya da kariya wajen kare hakkin rayukan mutane
1164,allah yana jiran su amadakata inda babu wanda ya isa yatsere masa  allah ya kawo mana dauki  bamuda karpi allah baxa mu iyaba   endnorthbanditry
1165,allah na tareda kai baba uk finish putting sanction on nigera e no go work  nigeria is not iran  endtheprotest    maybuharisucceed
1166,kano ta dabo ci gari kano tumbin giwa yaro ko da me kazo an fika kano jalla babbar hausa kano mai yan kasuwa da yan boko kano baya goya marayu kano mai dala da goron dutse mutanen kano masu daraj
1167,tuwon girma miyan kuka
1168,aslm mallam taska gaskiya kadaku a hannun basuka        ina ma ace gobe ne wata alhamis din allah ya kara basira
1169,looking gorgeous   rahama
1170,allah ya ji an sa  amin  duniyar aikin jarida da kuma fina finai sun yi gagarumin rashi  all h ya albarkaci abunda ya bari  amin
1171,ubangiji  yafada muna dabarun yaki  yanda zamu ci  nasara kan makiyan mu  al qurani
1172,allah ya jikan shi allah ye mashi rahama  allah yasa aljanna makomar sa  ameen
1173,nifa a ganina wanan dokar ba i tace mafitaba mafita anan shine a danga yi ma yan mata aure a kan lokaci in sha allahu za a samu mafita
1174,amin amma ki tina muna bin watan musulunci ne sabida muna koyi da annabi ne
1175,business nawa kkeyi ne     gaskiya matan arewa yakamata kuyi koyi da da ace matan arewa haka sukeda zuciyar nema irin na aunty rahama da tuni baa wannan stage din mukeba  aunty rahama allah yasa
1176,yaaallah kayi muna sauki
1177,happy birthday   allah ya karo shekaru masu albarka
1178,it s really touching   we are praying for you    allah ya kareku yakuma kara maku hikima da basira
1179,sun gane annabi isah ba dan allah bane yau wlh
1180,allah yakawo mana karahen chutarnan a daina wannan rufe rufen dan al farmar wannan wata mai al barka
1181,i dey tel u  kinda making me lose hope for the system  allah ya sauwaqa
1182,toh allah ya taimakeki
1183,the mallam i ve ever known in nigeria  allah ya gafarta maka
1184,toh allah ya yaye masu wan nan bala i amin
1185,mai shiga gidane  congratulations on your birthday
1186,toh sannun ku da aiki  angaishe ku
1187,wow so splendid in splendours of beauty hajiya as always kullum kara kyau kikeyi  allah kara daukaka
1188,dan haka muma muke sonki muke kishinki muke kaunarki
1189,innalillahi wa inna ilaihi raji un   allah ya jikansa da rahama  allah ya baiwa al ummar musulmi haqurin rashin dattijon arziki
1190,allah yabiya sarki sunusi
1191,subhanallah allah yasa mucika da imani
1192,maryam ibrahim badamasi babangida  ba na taba mantawa da gudumawar ta ga iyayen mu matan karkara da shirin ta na                 better life for rural women  allah saka mata da aljannatul firdaus
1193,innalillahi wa inna ilaihirraji un  allah yamana maganin duk wani abunda ya gagaremu
1194,dan allah ki yi hkri  haka rayuwar mutane ta ke amma ya sani ke kin yi gaba  kuma ba ke kikai kanki ba allah ne ya kai ki gwanata kuma shine gatan ki
1195,allah sarki kannenmu
1196,allah ubangiji y kara daukaka bua domin mutum ne na talakawa ya fifitashi akan duk wani wanda zaikowa talaka tsadar rayuwa    idan shima yana cikin wayenda suke bawa talakawa wahala allah ya musa
1197,allah ka kawo mana dauki badan halayenmu ba
1198,allah ya kara was rayuwarka akbarka da nisan kwana mai amfani  happy birthday
1199,allah yabamu ikon mantawa da ita har abada
1200,guy nan gsky yan burgeni sosai
1201,sadaukarwar da yayi wa nafisa saboda farin cikin tah
1202,muna godia allah bada lada  mu gwauraye irin wannan wankanne yake dan keeping namu busy
1203,ko anaso ko ba aso sai munyi sallar idi insha allahu
1204,shugaba jagaba abin yabo  saw
1205,innalillahi wa inna ilaehirrajiun may allah have mercy on us xunubin mu yy yawa we have to stop our bad behavior wlhy
1206,fata nagari ga wanda yafi alkairi
1207,allah kasa naga alkhairi
1208,allah ya gafarta masa  allah ya kyautata makwancinsa
1209,yayi babban yarinya za a ci amma kema kici da hankali ko barka da sallah
1210,yan samari  da fatan an fahimci wannan karatun    ranarhausa
1211,yana da kyau a gyra  saboda akwai dokokin da yana dakyau ace anyi musu kwaskwarima  fatan nasara
1212,chirrr                  muna nan tare daku allah taimaka mun matsu wallahi munyii missing din dan gwambo
1213,kano ta buhari ce tun asali  allah ya taimaki baba  wannan taron daman na yan papalolo ne
1214,anayi munajin dadiii
1215,allah yanuna mana naki    shilatu
1216,bakomai allah ya yemana afuwa gabadaya
1217,mu samman inkaxama masoyin manchester united
1218,wan nan hadin yayi fah zanga idan hajiya
1219,allah ubangiji yaqara yimuna tsari ga dukkan miyagun mutane na boye dana bayyane allahumma ameen
1220,insha allah nigeria ce zatayi nasara
1221,sannu da kokari  naji dadi sosai da naji hirar ku da ta kasance da harshen hausa
1222,masha allah  allah ya karemu da sharin masu shari
1223,cc allah shi kyauta
1224,ina lillahi wainna ilaihirrajiun    ya allah see us
1225,gsky mu a masallachi zamuyi kunji
1226,allah ya kara lpy    ameen
1227,my bebe ta iya kwalliya
1228,allah yagafar tamasa ameen
1229,i really like this thing bakina harya tara miyau dukda in azumi gwadabe aragemin nawa gsky
1230,yanzu haka ga shi kanin mahaifin nawa nan munyimasa wanka munasamasa likkafani inshaa allah munajiran gari ya waye mukaishi uhmmm
1231,allah ya kyauta  najeriya a kasa
1232,kunajin dadin juna
1233,ubangiji allah ya karemu gaba daya  allah ya kuma shiryar damu gaba daya
1234,allah kara tuna masu asiri yabamu zaman lfy me dorewa
1235,aibin ta yafi amfani ta
1236,allah yakawo karshen abin
1237,babe ansha kyau as always
1238,azeem    prefect haka ake so mutum ya za mo mai kauta ba mai      9ice 1
1239,allah yaimiki yadda kike so
1240,baby kinyi kyau wallahi
1241,a taimaka min
1242,toh muna nan dai munayi kawai abunda zamuceh allah yakaimu sannan kuma allah yakarbi ibadun mu
1243,innalillahi wa innailaihi ilaihi rajiun  allah ubangiji yajikansu da rahama  allah ya kyautata tamu karshe
1244,ehhh to anawa ganin gaskiya gidan ango yapi kashin kuddi dalilina shine ginin da zaiyyi da kuma kayan lepe idan wannan kawae akabarshi dashi gdn amarya xaiyi wuya sukashi kudin da zai kashe
1245,allah kawo mana karshen corona malam
1246,ameen the gorgeous rahama
1247,domin muna nushadantuwa
1248,dabino kowa ya shuka ki ya ysufa ya barki
1249,daman ke fans din barcelona ce    yanzu nakara sonki
1250,wannan mutanen kasar suna burge ki gashi kuma ke baki gajesu ba   ya kinga neymar a paris din kuwa
1251,ai kaima kana ciki babban darakta
1252,aine allh y hadani d irin laila takamu d matukar sona
1253,hanty things are getting worst      allah kawo mana karshen wanna annoba ta boko haram  banditry and kidnappers   securenorth  zabarmarimassacre
1254,ina jin dadin fina finan ki sosai
1255,hahaha yayi yar india
1256,allah ya jikanka oga
1257,amman kunada yanda zakuyi amfanida jami an tsaron don biyan bukatun kanku ko  hmmm   gakunan ga allah bamuda karfi bamuda dabara sai allah madaukakin sarki subahanahu wata ala mun barku dashi
1258,rahma dolane film din rariya ya dau awards sbd yayi ma ana sosai kuma fadakar wane ga iyaye sosai the very best film
1259,muje murokama nigeria xalan lafi a
1260,this breaks my heart  you re really a strong warrior  allah ya bamu lafiya  aminnn
1261,yau take sallah a wurin barca fans
1262,iya shugabanci da sanin yakamata adalci taimakawa mutane a cikin kudin aljihunka bawae sae kudin gwamnatiba rashin nuna banbanci kadan kenan ga abubuwa nan da yawa
1263,allah ya mana kariya da kariyarsa
1264,wanda hannun shi yake abin shaawa kowa yana so
1265,gsky bbu karya film naki yyi kyau sosai kin bamu mamaki allah yakara maki basira yar uwata da kuma sa an rayuwa god many many bless you
1266,ubangiji allah ya rayaku
1267,uban musulmiii   allah yataya riko
1268,baba buhari dodar  allah ya taya riqo
1269,allah yasa hakan tafaru mufara ganita ta sambade bade
1270,allah ka taremu saboda annabi
1271,masha allah      allah yanuna mana ankammala wannan aiki lfy  allah yayi maku jagora shuwagabanni na nagari
1272,malam aminu ina tare dakai a duk wata qafar sada zumunta  sbd qauna                 please ga layina dan allah inaso muna gaisawa 08064273095 ngd
1273,ba nigeriya ba  kena allah yakawo mana karshen kashe kashe a duniya baki dai dan darajar annabi
1274,hhhhhhhhh i love this abun yabada citta
1275,allah ya iyakantar da ita a nan  ameen
1276,ameen summah ameen kuma allah ya kaara baki chigaba
1277,tushen arziki
1278,baba ganduje mun gode  jamaa sun sami ciko saboda damina
1279,innalillahi wa inna ilaihi raji uun   ku i kamar ri i
1280,katsinawa kunji dad inku
1281,allah ya tsayar chan
1282,wayyo allah na  wannan ya burge ni sosai  how much please  i wants buy for
1283,allah yasa wajen exams ba social distancing
1284,walhhy kuwa allah dai ya bamu adalin shugaba mai adalci amiiin
1285,allah kadai yasan gsky wlh kuma yanaganinku
1286,always kara kyau kike
1287,kafisu gsky baba
1288,dan allah malam aminu saira kacewa lukman inayinshi 1000  kuma dan allah wnn wakar da summayya tayiwa lukman a ina zan samu complete nashi
1289,allah yayi wa mallam rahma yasa ya huta ya kyautata namu zuwan
1290,allah ya hada dan kwambo da taska a cikin gari
1291,yau nigeria riko sai mai gaskiya  baba buhari kai mukeso nigeria
1292,allah ya ba wa baba lafiya corona kuma
1293,allah ya qara basira asnanicccccc
1294,allah ya kara basira da daukaka ameen
1295,indai zazzagawa dai sun kasa fitarwa to zamu nada musu sunusi lamido sunusi      allah izaba muku nagari mai tausayin ku
1296,beautiful queen   of kannywood
1297,barka da sallah gimbiya
1298,allah sarki abin gwanin ban tausayi allah yajikan muslmi
1299,kano ta dabo cigari koda me kaxo an fika  kano baya goya marayu goya naki ki goya dan wani ina alfahari da kano sabida shine madina nigeria garin malamae garin masu kudin duniya proudly bakanuwa
1300,allah yayaye mana wannan annoba dan al farman wannan wata mai al barka ameeeeeen
1301,ohh  kwana biyu kuma yan india ne sukaxo kan wannan baiwar allan toh dan temaka ki fassara mun wannan waqar don allah
1302,allah ya jikanta ya gafarta mata allah yasa aljanna fiddausi ce makomar ta
1303,ka yi mn daidai singham
1304,irin wannan tinanin yana cikin abubuwan da suka bawa pdp matsala dan haka anemi alkairi kawai agun allah
1305,wannan gsky kafada wlh
1306,kagaa buhari kamar wani saurayi dan allah
1307,ai kuwa dole na tirke ragona na kauye  allah ya bani sa a yajin aikin nan yakai karamar sallah    shagali kenan
1308,allah ya kara miki lfy da basira
1309,allahu akbar  allah yasa malam yana aljanna   masu hanu akisan mal allah ya walakanta su tun anan duniya  amin
1310,bafa zamu fasa zuwa masallaci ba     allah yatsare mana imanin mu
1311,allha ya kareka daga makiya zango daga masoyinka abdousalam niamey niger
1312,allah yasa qarya kuke
1313,ni dai ya kai mu club mai kyau
1314,allah mun tuba kaya fe mana laifukan mu ka yaye mana wannan bala in amin
1315,s a w  allah ya karawa annabi daraja ameen summa ameen
1316,hakkan yayi dai dai  congratulations our next president 2023
1317,kina chilling hajiyata
1318,ku biyo mu a shafukan mu domin samu video masu nishadantarwa  fadakarwa  waazantarwa  illimantarwa  tweeter    instagram    i m on instagram as install the app to follow my photos and videos
1319,ni kadai nasan farincikin danake ciki akan wannan ci gaba da kasarmu ta samu      nigeria kasarmu tagado
1320,allah yakara basira my best
1321,innalillahi wa inna ilaihi raji un  akace 43
1322,director wey follow us fight na him we go support  allah ya kawo mana karshen halin da muke ciki a kasar nan  jama a keep watching saira movies
1323,ubangijin allah yasa yayi shahada ameen
1324,allah ya kara masa imani da nisan kwana kuma ya tayashi sauke nauyin da yake kan sa
1325,queen rahama allah ya kara miki daraga
1326,kai wonan tsohon kaidai har yanzu baka gajiya da bamu dariya to muma gata 1 minute clap for him
1327,hmmm karon farko a dadin kowa da mutumin kirki ya chi gaba                 malam nura a mataimakin headmaster
1328,allah ka rufa mana asiri duniya da lahira    mun tuba ka yafe mu
1329,lallai kam bahaushe yayi gaskiya da yace                 idan da ranka kasha kallo                 wannan batu haka yake     jinjina ga wannan kwararre kuma za a urin mai  aukan hoto
1330,allah y bada kasuwa mai albarkah
1331,allah ya kara masa lafiya da nisan kwana
1332,kaji gaskiyan magana alaji anan muna reta
1333,muna godiya daddy allah yakara daukaka company
1334,macha allah rahama
1335,ubangiji allah  sa munyi ibadun mu a sa a ameen ya allah
1336,binta kutigi is madly   allah ya kai mu ranan bikini
1337,much love  muna farin cikin da xuwan sa
1338,duba ambaliya ta jirgin sama  to allah ya kyauta
1339,al ummar yankin arewa mu kuma namu ta qare sedae fatan allah yasa mu cika da imani
1340,naso ace rahamatace ita nai tsammani duk dayane anatare but fati ma tamuce inataya murna
1341,allah kawo maji na gari kaman ni
1342,happy birthday my hero   mentor also  ubangiji allah ya qarawa sauran shekaru albarka amin
1343,gaskiya ya kayatar babban farincikina naga na next week su adama sundawo  zai km bada citta
1344,allah mun tuba ka yafe mu
1345,hankalin ka ya kwanta
1346,duck wanda yace ummaru musa yar adua allah ya sakashi cikin aljannah albarkacin wannan watan mai rahama
1347,gaskiya duniya tazo karshe   allah yasa mucika da imani
1348,allah yabata marsandi
1349,barka da yamma
1350,allah ya ji an su amma su kansu jiragen ruwan a samu masu lafiya da kayayyakin ruwa wanda mutum bazai nitse ba  allah ya ji an su ameen
1351,ke rahma       fadin gsky kyauta ne
1352,hbd baba jonathan mainasara
1353,abba na kowa
1354,dan allah  ku barshi    akwei freedom of speech    wahalan shi kenan      sai muduba meyasa yayi reni             shi yasai  akakirashi gwabnatin  democracy    live4zacreata       ire o
1355,wayyo     baiwar allah babu ruwan ta
1356,godiya muke   one luv
1357,allah y kawo kasuwa
1358,muna goyon bayan gwamna zulum allah yaqara temakon shugabannin nagari
1359,masha allah allah ya maimaita mana amin nice look   allah yakaro daukaka
1360,amennnn summah ameeen ranka shidade
1361,allah ya kawo musu akrshen abun
1362,kuma zai zama shugaban kasar nigeria    insha allah
1363,hhhh  allah yaqarama sarki lfy wannan yare haka
1364,ashe da gaske batun da wasu mutane suke cewa shugaban kasa baisan abubuwan da suke faruwa a kasar ba  saboda ma aikatan da ya dauka kuma ya yarda dasu basa fada mishi gaskiyar halinda arewa take
1365,su godema allah ma da ba a doramasu riba ba
1366,gaskiya wannan gayen ya burgeni wallahi
1367,hakan ya nuna cewa daman bai chan chanci wannan kujere da yake a kai ba     allah ya kyauta kawai
1368,allah karaba nagari d mugu ama banda    baza ayi haka ba sbd sunada yancin yin hakan
1369,allah y kai haske kabarinsa alfarmar wannan wata mai alfarma
1370,a gaskia zan fi fatan samun mace mai irin halin lukman a soyayya domin juriyarsa da yarda yake sarrafa kishinsa zuwa kishi mai tsafta domin samun kyakkyawar alaqa da wacce yakeso   toh ga mace ma
1371,subhanallah akwai allah ae  xai kula dasu
1372,barka da warhaka
1373,allah yasaka da mafificin lada
1374,kizama ta gari mijin zezo har gida ranki ya dade
1375,rahma sadau ma ta yi biyya wallahi
1376,ameeeen ya rabbal alameen
1377,masha allh munanan xuwa
1378,allah ya kara daukaka jagora muna bayanka
1379,allah mana tsari dashi hajiya
1380,duukan mayu  aradu kullum qaara kyau kikeyi  kinga hankalin mu kwance zamuyi posting pics na gwanarmu
1381,allah yasa muma ayi mana gobe
1382,kin fi kyau a irin wannan shikar amma sai kita sanya wadansu kaya agareki rahma
1383,alhamdulillah alhamdulillah alhamdulillah allah ya kawo qarshen wannan musiba a duniya baki daya
1384,allah ya kara albarka ya tsare daga sharrin masu sharrin      jumaatmubarak
1385,allah y jikansu da rahama
1386,allah ya saka maka da mafificin alkhairi   see your brother
1387,namijin duniya allah ya taimaki kasar mu allah kaciremana bara gurbin cikin mu ameen
1388,alhamdulillah      saura hukunci
1389,daman ai a cikin barazanar kasar take kawai dai allah ya kawo mana sauki
1390,daman ai akwai  kasamu wadda kakeso
1391,wow masha allah nayi farinciki kasar saudi ta doke egypt
1392,toh ra ayin mu dai shene daman hakan mukeso baba yasake tsayawa takara sai baba insha allah
1393,no place like home          nijar ai sun fimu security da samun wuta  yanxu
1394,allah ya baki lafiya aisha   allah ya yaye miki wannan cutar   allah koma ya hadaki da aa nagari
1395,ki roki allah gafara baki roki mutane ba mutane zero ne nemi afuwar allah ki bar abun da zesa allah yai fushi dake l
1396,toooo   ya gaishe su
1397,allah yakyauta yakuma tsare imaninmu ya rabb
1398,mallam dan allah muna rokonka da kar a dawo shirin  labarina sai bayan azumi dan allah mallam
1399,ada na xata girman kai ne da ita amma yanxu na fahimci ba hakan bane please forgive rahma
1400,gaskiya hakan yayi dai dai
1401,masha allah    kiyi following na mana jaruma na
1402,allah na tare da ke
1403,allah yasa talakawa su anfana  ameen
1404,toh rayuwa kenan haka allah yasu duk sana a indan kanada abinci sai kayishi  allah yasamudace
1405,in figures but not in reality    allah yasa mudace
1406,yauwa yy kyau     itama taji abin dayaji
1407,allah yasa hakane mafi alkhairy ga wnnan sahri a
1408,ba shakka wannan zai taimaka wajen kare matasa daga fadawa tarkon yan ta adda idon sukayi amfani da yanar gizo ko fcbk ko twitter
1409,kai bbc   kuji tsoron allaah
1410,allah ya kyauta ta makwanci
1411,allah yasa mudace yazama gatanmu sbd annabi muhammad s a w
1412,allah yakarawa malam lafiya tabbas kanunawa duniya kana kishin al ummarka da addininka yaimaku sakamako mafi alkhairi
1413,mine is sem as urz auntie rahama
1414,gaskiya wanda yayi magana a karshe ya burgeni
1415,allah ya kyauta kushewa
1416,gaskiya zanji dadin dawowar sa domin adahama yana bamu nishadi
1417,from frying fan to            allah ya kara kiyayemu
1418,asshaaa   allah ya kara sauwaqa mana kan wannan annobar
1419,mu dai namu addua ne   allah ya bashi lafiya
1420,garin adamawa  land of beauty    garin addini   garin fura   mutane masu son juna da zaman lafiya  mazan kuwa sun iya soyayya da kula da iyali
1421,dan allah kema kidin bada shawara mai kyau koda xaki samu mabiya kyawawa
1422,allah yakara nasara da daukaka
1423,soja  soja   soja    kana samun karin matsayi  kana shiga u ubobin yaki  wasuma sukace   kwanakinka na ragewa    allah yakara tsaremana sojojinmu
1424,mashaa allah  allah ya sa muna cikin wadanda za su shaida hakan
1425,allah ya gafarta wa musulmai amin
1426,my favorite person inayinki
1427,allah ta ala yakiyaye nagaba
1428,allah ubangiji ya mana tsari daga sharrinta ya kawo mana karshenta da gaggawa alfarmar wannan wata mai albarka  pray for kano
1429,babban darekta   ta kai ma
1430,kafin rasuwar mamana tace sakani dariya kuma nagama da ita lafiya kuma tacemun xanga alheri a rayuwata ina farinciki a duk lkcn da na tuna hakan
1431,kana burgeni ndume    sbd sakin magana
1432,ku ce mai yayi hakuri    allah zai saka mai
1433,allah ka jikan bayin ka allah ka karbi shahadarsu
1434,allah kawo mana saukin wannan musiba
1435,allah karo kasuwa mai albarka thom
1436,kawae eh irin totally                                                miss you so much
1437,allah ya qara lfya muma muna taya kanmu murna cika shekara 14 muna azumi 30 na ramadan duk wata
1438,e munsan da haka  amma kuji tsoron allah ku fadawa gwamnati gaskiya  kamar yadda kuka yi mata kamfe
1439,allah yasa ganawanda sukayi ya taimaki talakan najeriya
1440,allah ta ala duk masu aikata wannan musibar ta fyade ya ubangiji allah ka wulakanta su tun a nan duniya
1441,allah yasa sowarware wannan matsalar fyade amin summa amin
1442,allah ka karemu ka kawo maba afuwa
1443,aci gaba da taya wasu munna
1444,alhamdulillah allah ubangi ya kara bawa kasarmu zaman lafiya ameen dai
1445,wai me kike ci kike irin wannan girma ayya kuwa
1446,bbc hausa da sauran ma aikatan ku maza da mata wadanda duke nigeria da birtaniya ina taya ku murnar cika shekara
1447,mashaallah  tayi mun daidai  sai dai kuma kada ta zama vampire  danyen nama haka
1448,allah ya jikan duk al ummar musulmi gaba dayan mu imm tamu tazo mu cika da imani
1449,ansha kyau washa fati
1450,innalillahi wa inna ilaishi rajikun allah kare mu shi kuma ka baiyana shi
1451,allah ya kaimu    dan kwambo once he said                 kaji abu sai kace naira
1452,hakayake wanna maganan gaskiyane
1453,daga   birnin spain kusa da gidan mr jackson nima ina goyon bayan hakan
1454,gaskiya e no dey show for face  basu da kama  sai dai  ana iya dace thru addu a  sai kuma mai neman ma ya kasance of gud xter n conduct
1455,pleasss kibar answer su         allah yashiryemu kawai  arewa twitter please let s be good for once
1456,masha allah    allah sa muga watan cikin masu rai da sa a
1457,wayyo  allah yasa yasan kinayi
1458,mai dadinci da miya
1459,muna godiya  sheikh ahmed mahmud gumi  allah yakareka yakumu yawaitamuna irinku cikin malumanmu abundakakeyi shine jihadi
1460,hhhhhhhh to allah yataimaka malam bahari
1461,rahama sadau manya
1462,alhdllh inacikin masu neman shiga mallam aminu sairah
1463,da kyau   allah ya kara basira
1464,da kyau me ke faruwa
1465,allah ya jeqa sa muma e tamu taxo mu ceka da emani
1466,subhanallah  allah yakawomana qarshen ta
1467,happy sallah rahama sadau
1468,allah yasa mu dace  allah ya tona asirin su
1469,ai duk me sauqine seku maida masu da kudadensu atari badi me rabon zuwa yaje  allah kasa muna cikin na badin amin ya hayyu ya qayyum
1470,kundace sadau  dama kuyi aure
1471,gaskiya musamman a wannan lokacin komai yafi fitowa fili  allah yasa yana da rabon musulinci kafin ya mutu
1472,allah ya bada ikon sa a dan allah a roka mana zaman lafiya a kasar nan dama sauran kasashen african da duk inda musulmi yake da zama baki daya  allah ya dawo da kai lafiya
1473,dis babe fine small ooh  u added more weight bttr maintain it  kina kaman faran nan kinfi kyu slime issa bea
