id,tweet
2180,gaskia yana burgeni shirinnan
2181,yayi dai dai sarki
2182,ya rabb kasa tazama sanadiya gani chiwa yanada mahalichi yayi nadama ya zamma daya daga chikinmu musulmi ya haiyu ya kaiyum
2183,noted sir  allah yasa mudace
2184,masha allah  fatan alkhairi ga dukkanin mai aikatan voa hausa
2185,allah ya kawo mana karshen wan nan masifar ameen
2186,allah ya tabbatar wa amurka zaman lafiya  dama duniya baki  aya
2187,da so samu ne     ranar haska mati a zazzau mu dauki hoto tare 24 7 naita smiling
2188,baby dan tsaya    akwai zance daya    kin hadu gaskiya
2189,allah sarki gaskiya munyi rashi allah yai masa rahama
2190,happy birthday daukaka ta allah ce shi yadaukaki wasu suna nuna bakin ciki agareki allah yakiyaye gabanki da bayanki
2191,ubangiji allah ya bada nassara  yaushe za a nuna a jigawa
2192,r i p yar adua
2193,abu huraira yafitar da wannan hadisi daga manzon allah  yace duk wanda yatuba kafin randa rana zatafito ta gabar allah yakarbi tubansa  imam musulim  allah yakarbi tubanki muna kaunarki a cikin m
2194,battery full of charging ga data lallai xa adade ana bugawa ya
2195,zuwan buhari jarabta ce daga allah bisa laifin da mukai  allah mun tuba  ka yafe mana
2196,mun gode mishi fa san nunshi da aiki  amma dan allah yaushe zai sauqa ne kam nina gajida mulkin shi
2197,allah yakara lafiya da nisan malam  allah jikan malam jafar muhammud adam amee
2198,allah kara lfy yan maza ya bada hakurin dauka yan mata
2199,dakyau gaskia ni atahirin nan ba abin da yafi daukar min hanka li irin sunan matarsa da na yaransa kamar sunan aljanu wai kiki fiyinfoluwa da kakisola
2200,masha allah wanan gaskiya ne allah nuna mana allah sa adace ameen
2201,allah yakare mana megada kandaki
2202,lallai dai kam shirin  labarinaseries episode 9 ya kayatar  sumayya ta yi ragargaza  muhamud yana bukatar ya koma makarantar soyayya
2203,koh zakikomah ne saudi inne gari mai tsarki   allahuma balligna saudi arabia ameen
2204,allah sa ba rokon ki yayi dai ba
2205,allah ya jikanshi allah ya mishi rahama
2206,banda abin ku bbc ai ba a san maci tuwo ba sai miya ta kare  jamu muje dai real madrid
2207,komin lalachin shugaban kasa akwai wani bangaren da inya tafi za a che kwara shi da wani  allah taimaki nigeria
2208,allah yasa iya can be dokan zaiyi aiki
2209,allah yasa da gaske suke domin munriga munsan halin shugabannin namu
2210,aks her to pay their backlogs first  nigeria    my country   allah yabamu shuwagabanni na kwarae
2211,sun kyauta haqiqa sunyi abin ayaba masu
2212,wlh sosai ma kuwa  allah yakara basira da daukaka duniya da lahira mallam
2213,alkur an kinfi haka nima yaro dani am 27 bareke  happy birthday and i wish u more years ahead
2214,prince mai jiran gado at it again wannan yaro dai allah ya mana maganinsa  annabi muhammadu s a w yace                  kuje aikin hajji kafin a hanaku zuwa
2215,alhmdullh i now have peace of mind wlh daga jiya zuwa yau naji haushin da na jima banji ba  ace a kasan hoton musulma ana yiwa annabin mu suka  kin riga kinyi maganar da ta dace amman dan allah a
2216,allah ya basu sa a su chapke dan ta adda
2217,tir da wannan lamarin gsky jamaa aji tsoran allah wllh duniya alamun kashen ta sun fara bayya na ra ayil ai allah kasa mu dace amen
2218,yayi kyau allah ya kawo mana karshen wadannan masifu da suka addabe mu
2219,allah yakawo ma jama ar kaduna dama najeriya saukin wannan al  amari
2220,tofa     allah yasa dai muji alheri manjo     mungaji da gafara sa bamuga kaho ba     sai karar damu akeyi mu yan arewa
2221,qur ani madeenah ta ji hausa    ubangiji allah shi kara daukaka
2222,gaskiyane malan da malan
2223,barka da arziki faty  allah qara albarka
2224,muma muna bayan ku
2225,what happened was awful     but always m prayers for her is that may this clip saga be d reason for her repentance from all sorts of awful things    kowa pa nada nasa kashin a muriyan shi   allah
2226,kai jama a our kd people finally dai       abun nema ya samu
2227,aiki yna kyau amma gsky yakamata afara haska shirin labarina sbda mun kagara
"2228,11944,'yar aunty ina yinki ,positive",NaN
2229,allah yajikanshi da rahama allah yakawo mana wanda zai maye abun dayayi niyan aikatawa nigeria munyi babban rashi
2230,allah yasa banda budurwa ta
2231,aikinku yy kyau
2232,allah y kyauta y kuma yi mana maganin wayanda suke daukar nauyin kungiyar boko haram amma mu ma fah y kamata mu dawo mu bi allah sannan mu yawaita istigfari se allah y kawo mana dauki chikin hali
2233,gyada uwar sihiri kabare kaga biyu ka murza ka ga hudu ka tauna kaji gardi
2234,allah ya tsare musulinci da musulmai baki daya
2235,ciki da gaskiya yafi ciki da qarya
2236,allah yakara basira buzu
2237,allah ya kiyaye gaba magu
2238,ameen yar mama
2239,toh allah yakyauta dai    amma nidai wnan abubuwa nakasar nn tamu yafara bani tsoro
2240,allah ya isarwa addinin musulunci da musulmai
2241,allah ka amsa mana   allah muntuba badan halayan muba allah karka kamamu dalefin wawayen cikinmu yah allah kadubemu da idon rahama badan halin muba
2242,wannan gaskiya ne your excellency
2243,ya subhanalla  allah ya tsayar
2244,wannan shine shugabanda yafi kowane shigoba a tarihin nigeria da allah yayimasa tsawancinkwana dabamucikin wannan halin  rip
2245,allah kawo mana qarshen wannan bala en
2246,allah ya bashi ikon sauke nauyin da ke kansa  idan kuma da gangar yana kall0n abubuwan da ke faruwa yayi shiru allah ya sakama talakawan da duk rana ake kashe su da kuma wa enda yunwa ke kashewa
2247,allah ya tabbatar mana da zaman lafiya a yankin arewacin najeriya  sannan ya kuma sakawa malam da gidan aljannah
2248,matar nan bata da matsala
2249,allah yace inkawa aluma adalci zama adalci      allah ya bamu shuwagabani nagari
2250,bai san mey yake yi ba gaskiya    allah ya karya shi
2251,allah shirye ku saudiyya
2252,allah ya bayyana shi cikin koshin lafia
2253,allah ka ceto kasar mu daga rushewa
2254,maa sha allah  allah yasa a bude dukkan makarantu harda na islamiya
2255,kanawa suna godiya baba ganduje
2256,hmm dama ai shi babban mutum mai sauqin kai baicika son ace shi wanine ba allah  yakara daukaka
2257,allah dawoda kai gida       lfy
2258,allah ya miki albarka allah baya son mutum mai riko
2259,ameen ya allah annabi yasan da xuwan sa
2260,babe gaskiya kinyi kyau  tubarkalla
2261,allah ya gafarta mai yasa ya huta mukuma allah yasa mucika da imani
2262,dan allah kuzo nigeria kunga muna siyan kayanku plzzz come help us
2263,ya allah ga bawanka nan zaija da addininka  ya allah ka nuna masa iyakarsa  ya allah ka kara daukaka musulmai da musulunci ya allah ka qarawa annabi muhammadu s a w daraja  wasila da fadhila
2264,allah sarki talakka bawan allah  ya allah kazama gatan talakka
2265,allah ka tsare mu daga wannan annobar coronvirus din
2266,wannan kwalliyar da mijinki kikayiwa saiyafi ganin kyau dinta
2267,wow rahama u luk vry beautiful  allah y kara shiga lamarunki yarabaki da sharrin makiya
2268,anty rahama   i really feel for ur kokarin to dauki mirror selfie
2269,in kaji tambura se sarki  jeji ba a maka kyaure sede mahaukacin kafinta  tsamiyar kan kabari haramiyar masu kunu
2270,allah ya kawo karshen wannan balao in dake addabar mu a najeriya
2271,wata zatayi murna da wannan labarin
2272,fati yar gidan washa
2273,nasidi adamu yahaya loves   his mum so much
2274,allah ya kyauta allah ya kawo mana karshen wan nan masifan
2275,pls my aunty  idon kuka samu kanku a irin wannan wuri  kukare mutuncinku da addinku  amatsayinku na musulmai
2276,allah ya tabbatar da zaman lapia
2277,allah baki na halal yasa musu albarka
2278,allah yasakama wannan yaron
2279,innalillahi wa inna ilaihi raji un  allah ubangiji ya gafarta mai ya kyautata tamu
2280,ubangiji allah yasa mudace dunia da lahira
2281,ameen ameen    amma fah wannan dimma yayi dadi ba lefi
2282,sunyi kukari gaskia yan nigeria nawa zamu hada mu ragewa buhari nauyi
2283,mey kukeso mu koya  munada jari neh  mun dai yi aure munada ciki yanzu haka  kumaarewa24 suna nishadantar damu
2284,allah ya jikansha da rahma yasa iyakacin wahala kinan
2285,allah yakiyaye yasa yazama alkairi ga yan nigeria
2286,wannan haka yake inda ranka kasha kallo buhari ikon allah buhari na allah buhari mai talakawa
2287,allah yakara lpy da nisan kwana
2288,ikon allah wani dan baiwa na karatu da muryoyin sudais  muhammad ayyubi  shuraim  da sauransu  watch   subscribe and share to other muslims umma
2289,arewa angel much love
2290,to allah ya qaru ilimi da fusahah da dubaru kalakala na film   da na sauran ayuka
2291,allah yakai rahama kabarinsa amin
2292,yau da gobe kawai shawara daya ce ayi abandon na jami o i masu zaman kansu a nigeria kamun nan na gwomnati ta inganta allah yasa
2293,saidai hassada amman wllhy kin wankuuu
2294,yauwa don allah adubashi da kyau saboda tsaro
2295,masha allahu allah ya qara basira da ilimi mai amfani
2296,sauran shugabanin kasa she su tuna tarda shi   ce wa ya manta da talakkawan sa da yayi wa alkawali  kuma haryanxu shuru   ne ba labari
2297,subhanallah allah yajikansu  wadanda suka rasa wani abu nasu kuma allah ya mayar musu da alkhairi
2298,babban directa    muna nan mun ziba ido  allah ya bada sa a
2299,allah ya sanya alkhairi   ya kuma tabbatar da dawamamme zaman lafiya a tsakaninsu
2300,sun mun dai dai wlh
2301,allah yasaka makii da alkhaiirii ya  ara  aukaka  allah ya amshi ibadunmu na wannan wata maii alfarma
2302,sallah ita ke kara kusantar da bawa ga ubangiji   ta haifar da nutsuwa cikin zuciya      kalli ka karu    jumaat krm
2303,allah ka kawo mana karshen wannan bala i dake addabar yankunan mu na arewa
2304,allah yaqara tsareka adalin shugaba amin
2305,allah katsare al ummar nigeria   baki daya
2306,looks teenager  allah ya albarkaci rayuwa
2307,shinkafa da dadi allah ba mu kudi mu ci chinkafa mamar mamar
2308,ina matukar girmamaki har sai da na koma kiranki da  aunty rahma   na sha suka da zagi a kan kare martabarki amma hakan bai sai kin ji tausayina ba  duk da cewa ba a shiga tsakanin allah da bawan
2309,zaki iya gane mutumin kwarai ta yadda yake fifita abinda mutane keso fiye da zabinsa  ma ana dai wanda baya da son zuciya    allah yasa mudace
2310,because of my love to your life style am changing my handle name to saudau s fan right now  ki cigaba da ruta  mukuma zamu cigaba da binki da petir  ranki shidade
2311,allah ubangiji ya jaddada rahama a kabarin ki hajiyar mu
2312,sarki mai fkd   allah yakaramaka lfy tare da imani  amin
2313,aljannar ki na tafin kafar mijinki kar dunia ta rude ki ko ba mutuwa akwai tsufa   allah ya shiryemu    culture is not religion but i believe our culture suits islamic teachings
2314,sai a gyara idan anaso allah yayi keeping naku safe
2315,allah ya mai mai ta mana yasa ibadar mu karbabbiya che ameeen summa ameeen
2316,ameen summah ameen malam     wannan gaskiyane
2317,bayin allah nan sunyi karatu  allah ya saka musu da aljannah
2318,ramadan de yazo  atuba abi allah  ba aita bin office din  yan siyasa makiya allah ba tam
2319,gaskiya kayi hakuri amma banji dadi ba naso ache next week za a fara haskawa amma allah yakaimu lokacin da rai da lafiya
2320,hmm    she s an actress  allah yasa har zuci take nadama
2321,ameen don rasulullahi megida
2322,ance min kina lagos shekaran jiya ma kin zo area na shooting yaushe zaki dawo dan allah we have a lot to talk abt
2323,6ster yau fa fresh kikejin kanki
2324,ydg  fatan alheri ga ita  jkfagge  aje kuma aji da rainon jikoki
2325,allah ya kara lafiya da nisan kwana h j
2326,allah ka bawa mafi alkhairi a cikin su sa a
2327,arewa kenan kadan daga cikin halin yan arewa kenan wlhy kuma abun ya samo asali ne tun diga gun mayan arewa din wannan rashin hadin kan wlhy allah dai kawai ya sa mudace
2328,muna jinjina da fatan alheri gare ka mallam griezman
2329,kiyi komai ba komai  yar sadau aljanna ta mai rabo ce
2330,gaskiya tazamto jarumar mata
2331,masha allah   allah ya sada mu da alkhairin dake cikin wannan wata mai albarka na ramadan   ya hayyu ya qayyum
2332,aunty kisha shagalinki
2333,allah yatamaki yarima
2334,allah ya kara masa lafiya da nisan kwana  go ahead 2019 in sha allah
2335,ganduje gandun aiki
2336,bakya lefi kokinkashe danmasu gida
2337,good good ganduje
2338,iyali tafi komai
2339,allah ya dawo da kai lafya alhaji adam
2340,fatan nasara wa nasu bukatar shiga  mukam muna gida
2341,allah yasa hk ne yafi alkhairi
2342,munade mishi fatan alkayri
2343,kaga mutumin nan shi ta golf ma yake  ya hayyu ya qayyoom karemu daga wannan rashi tsoron na kasa
2344,ok allah ya kaimu ai naga za a sha dariya
2345,nima zanyi rakiyar zuwa ganin priyanka chopra
2346,allah yasa tallafin da zai bawa masu kirkire kirkiren fasaha  ta amfane su  su ma su zama wanda ake ji dasu a duniya ameen
2347,gaisuwa ga tauraruwar kannywood
2348,muna godiya mallam    garin da babu malamai  an giyama mallam ne
2349,wannan abu yayi dadi
2350,wannan kasa tamu allah muntuba
2351,wan nan ne hotuna da aka harbeshi  allah ubaangiji yasa acigaba da jikkata masu son kawo mana tashin hankali aksar mu nigeria             ya allah bless our dear county with good leaders
2352,sweetheart na kinyi kyau
2353,allah yajikan musulman cikinsu
2354,wai kam ke duk kayan da kika saka sai sun miki kyau ne  kina     pha
2355,wallahi kam muna miss din shi sosai
2356,allah ya sa nayi daidai
2357,anayi muna jin dadin
2358,allah ya gafarta mashi ya kuma sa aljannah ta zam makoma a gare sa
2359,varka da sallah allah ya maimaita mana
2360,if i guess right  you are now into estate  as in estate developer  arziki yaci uban nada  gaba dai gaba dai kanwata
2361,masha allah anatare mu gombawa munayinka
2362,yabi gaskiya da tsarin addinin musulinci allah ya daukakashi
2363,keep on doing the good work   i  the prime minister of nigeria ina farin ciki da abubu wanda kikeyi   allah yai miki albarka
2364,haba mlm  idan aka rasa irin rahma sadau  to watakila aji duriyar su  amma muddin sarauniya rahma nanan ai washa bazata ganu ba
2365,muna murna sosai barkada biyo madugu uban tafiya
2366,tho allah yai mana tsari dasu
2367,allah ya kiyaye faruwar haka a gaba next level ne
2368,ina yinki da dadewa  har ynx kuma ina kan yinki  kuma xan cigaba da yinki dodar
2369,allah cigaba da mana maganin su
2370,gaskiya dai allah yai mana dan annabi
2371,kowayyi da kyau dai   zai gani
2372,ashe dai tsohuwa ce matar nan  amma kalar yara gareta  allah yakaro shekaru masu albarka  happy birthday mamar su zahra
2373,inna lillahi wa inna allaehim raju um allah yajiqansu da rahama ameen
2374,ka chan chan ta wlh allah yakara dauka ka da basira damu baki 1
2375,damn  always looking gorgeous     didinmu       ammi s look alike allah yah cigaba da tsare mana ke yah kuma kara ma ammi lafiya da tsawon kwana  ameen
2376,innalillahi wa inna ilayhi rajioon  allaah ya gafarta maka  shakikin gwarzo kuma jagora na gaskiya da adalci  najeriya tayi asarar gwarzo  har ila yau kasar najeriya ta kasa samun wannan shuwagab
2377,allah ya karfi shahadarsu
2378,gaskiyar maganar kenan our peacefully
2379,wani abu sai nigeriya gaskiya banta ganin bikin shan rake ba sai a kano ko kano sai da shafin bbc hausa ayi bikin shan rake lafiya bbc hausa muna godiya da irin yadda koke yada muna labaro nishad
2380,sarauniyar matan arewa
2381,allah ya karemu damu da zuri ar mu
2382,allah yakara basira kuma allah ubangiji yacikamiki muradinki harxuwa lokacin allah y taimakemu daganaki sales
2383,allah ya shiryamu ya shiryasu gabaki daya
2384,allah yasa baba ganduje ya duba wannan lamarin ya sakemu
2385,good   yayi kyau allah ya taimaka
2386,wayyo allah     allah ya bk dangana
2387,sadau arewa princess
2388,allah ya tsaremu dan isar annabi
2389,sadau kugu ya fara cikowa    masha allah  da abu dan firit kamar kugun maza
2390,baba muna yinka har gobe   kuma in allah ya yarda dan nigeria sai yy alfahari da kai ko kana kai kkm sai bayan ka sauka
2391,muna  farin ciki  film din labarina yafara dawowa maudu in da aka katashi  god bless you ameenu saira
2392,malan dubarudu     good morning boss
2393,i still stand with mahmood  mota ma zaa siyanmai   dole dan talaka yaso kudi     labarina
2394,innalillahi wa inna ilaihi rajuun       allah allah kayi mana tsari da wayannan bayin naka marassa imani ameen
2395,allah yabachi lafiya sauran waenda basuda lafiya amin summa amin
2396,all of you saying she didn t attend islamic school how did you know ku fad i alkhairi koh kuyi shiru
2397,gimbiya beautiful halitah
2398,allah ya zaba duk wanda zai fi zama alkhairi ga jama a aaameen
2399,al qur ani allah yace                 wala tabarrajna tabarrujal jaahiliyail uula                 ashe dabi ar jahilan farko ne sai jahilan qarshe suke kwaikwaya  wa iyazu billah    allah ya shir
2400,ribar  afa      ka siyi  aya  a baka  aya kyauta
2401,inuwar giginya kenan  allah yasa mu gama lafiya
2402,ubangiji allah kakawo mana karshen wannan fitina data addabi yankina arewa albarkacin dan gatan k  fiyayyan halitta annabi muhammad rasulullah sallallahu alaihi wasallam astaghfirullah
2403,allah ya bada ikon aiwatar da alkhairi a kasar mu
2404,daman akwai wata rana ta musamman da aka ware ta don masoya ne  to nikam bari kuji na fada muku kullum ranar mu ce ni da masoyiyah bamu da wata ranar da ba ta soyayya bah  i love you my dear
2405,yana dai kan cikawa  sai dai kawai mu tayashi da addu a allah ya taimake shi
2406,allah yasa albarka yasa anbude a sa a ameeen
2407,ya allah kasa ayi damu a masallacin
2408,aii gani gareki yan mata ni ina rokanki yan mata so bani inn baki din ina kyaunarki
2409,allah ka qara isarma musulunci da musulmai
2410,mun yarda da allah
2411,idan har kana daga cikin wayanda iftila in gobara ta shafa yau a sokoto toh kashiga ka karanta yanda zaka samu tallafin kudi daga gwamnan kebbi alh atiku bagudu
2412,congratulations as dr  allah yakarawa rayuwa albarka
2413,allah sarki zainab    allah ya qara kiyaye gaba
2414,toh sannun ku da kokari
2415,congrat   kina wuta yarinya
2416,allah dai yabiya lallai kam babu shakka wannan abin koyine ga  an baya    nima sanata idan nasamo nawa kaine zaka mata walicci
2417,tuna shi da son annabi saw a ko da yaushe yana nunawa kuma koda a gurin sanaar shi   wannan shine babbar nieema allah yaji qansa da rahma yasa ya huta
2418,allah ya jikan dikko inde   tabbas katsinawa munyi babban rashi
2419,hahaha u are still a learner   ki komai ba komai wannan gurin jindadi ne ya kamata ki jidadi ramatu
2420,allah ta ala y shiga lamarin
2421,allah yakara basira sarki    muna mugun tare
2422,ameen   director na kwarai kuma dan gaske
2423,kai allahdai ya kyauta
2424,rahama yarinya mai tashe    ina yinki
2425,innalillahi wa inna ilaihiraji un ya ubangiji ba dan mu ba dan halin mu ba  allah mun tuba ka kawowa kasar mu zaman lfy ya allah ana kashe mutanen da basu ji ba ba su gani ba allah ka sassauta ma
2426,zamu zo domin ganin oga boss
2427,allah ya saka muku da alkhairi yasa ku amfana anan da can
2428,kai allah ya rabamu da jahilce basu ida badai a raba nigeria 3 kuma duk bakin cikin dan kaxa bayanda xai da dan shawo
2429,allah ka kawo muna karshensu a doron kasa    shine addu ar mu insunfi karfii hukuma basu fi karfin allah  s w a        shi zaiyi muna maganinsu
2430,tunda iya basilin kike shafawa afuskarki ina sonki zaki aureni   ammafa ni yaro ne bana yarinta ba  sainaji amsata
2431,ai komaima  ba irinsu mahmud ba dan allah a dawo mana da lukuman
2432,allah ubangiji ya taimaka falalu inayinka wlh dangidana
2433,in an dache za a samu alheri
2434,rahama kinga wannan shigar da kinkayi da hijab kema kinsan kinfi kamala  abunda kinka sanine komaifa lokacine yake dashi  komai jin dadinka komai tsawon ranka a duniya watarana sai labari    kiyi
2435,allah yakaimu zanzo nakarbi yawon sallah na amma nakeso abani
2436,allah sarki uwa itache jigo  itache keche ma da allah maka albarka    kuma da yardan allah sai kaga albarkan duk wani gata da wani zaima aduniya baikai wanda uwa tayi maka ba allah jikan ki da
2437,allah ya tsare hanya mr president
2438,ai har murnan tayi yawa  but its ok  sai baba
2439,hum allah dai ya kaimu kasa lokaci n a mlaikin billiyan dari n a dollars
2440,allah akbar       hannan she akekira musulinchi   dakoma kiyaye dokokin allah   allah yasa hakin yadauree   kar shedan ya shego chekin lamarin
2441,allah yasa dashi acikin shirin
2442,wow   yau anada lokacin fans kenan thank u
2443,ikon allah knn haka allah yake alamarinsa ya allah ka dubemu da rahma allah muma kayayemana da duniya baki daya ya azizu ya jabbar
2444,may the mighty king  allah  bless ur daily hustle  ubangiji allah ya biya buqatu na alkhairi  blessed
2445,kai gaskiya shirin yayi sosai
2446,masha allah fatan allah yakara basu nasara da juriya da hakuri
2447,harkin kara kyau for supporting barca
2448,gyada me sihiri abara aga biyu  amurza aga hudu atauna aji mulamulan dadi natashi
2449,allah yasa hakan ya xamo alkhairi ga alummar da za a mulka
2450,ahse kema kin sheda xee taji kyau
2451,dadina da ayshat buhari tafi mijinta kishin nigeria
2452,ya allah    ka kawo karshen wannan kisa da akeyi a duk wani state allah ameen
2453,allah yasa ayi posting enki maiduguri ko katsina ko zamfara tunda ynxu an koya muku yaqi
2454,kullum se dai ace allah y yafe batare d kuna gyarawa ba domin samun dacewa kawai kuna tsula iya hege da iya hegiya kuce allah ya yafe
2455,hakan yayi kyau matuka  naso naijeriya ma zata bi bayan pakistan    wajen aikata hakan
2456,allah koh babyn nan kina tsula tsiyafa like that enjoy your time wollah
2457,mukan adamawa ba abunda zamuce saboda munsamu canji dari bisa dari   wutan lantarki kam alhamdulillahi cikan hour 24 muna samun na hour 20 zuwa 22 to kunga ba abunda zamuce
2458,allah ya tsaremu ya kuma karemu baki days
2459,aslm inagaisuwa rahama   yakike ya gida
2460,kai maganace kawai  naje kano da soyayyar wannan yarinyar  amma babu wanda ya kaini sonta ballantana ya fini
2461,barka kadai fatan alheri
2462,man mukiyan ma sai an kara masa kudi  kai  allah yah rufa asiri
2463,banda hince malam   barka da sallah
2464,kemadai kibi a hankali karki janyowa kanki magana pls   domin ke bakida matsala kinji hajiya fati
2465,allahu akbar allah yayi wa malam rahma  ka mutu annan haryanxu muna tare da muryar ka tamkar kana a raye
2466,aljannah  da mata ta gari
2467,masha allah   allah yayi jagora  fati
2468,ki godewa allah   if ur father is nothing a 9ja to ya yan su ma is nothing  yaran su abin da suke yi a   ai yafi wanda kikai   allah ya yimana gafara gaba daya      we are all together
2469,i can t wait  allah ya  ara basira   aukaka da kuma arziki  amin   gidanbadamasi is one of its kind
2470,director abunda yakamata ayi kenan  amma dan allah kada taska ya samu komi
2471,kwarai kuwa ko bay hanaba za arage insha allah
2472,mude ga munan a sokoto zafi muke ta pama dashi allah ya kawo muna ruwan sama muma me kankaran
2473,gaskiyane   anyin hakan
2474,allah yabaka ikon yin adalci akasa baki daya
2475,sarauniya hausa the queen   of hausa movie
2476,allah yayi jagora queen   yar sadau
2477,dai daine wlhy may be zai gyra
2478,amin sarki muma kaine qwanin mu
2479,allah ya tabbatar    sorry
2480,mashaallah allah yakawo mana  karshen wannan mummunar dabi  a  amen
2481,to fa    allah ya kiyaye gaba
2482,sora nakii allah ya nuna muna naki musha shagali en bakin ciki su koka
2483,an gaida mallam garbati na baba buhari
2484,gsky hakan yayi kyau
2485,mai arzki ko a kwara ya saida ruwa
2486,ok toh yayi daidai haka mukeso
2487,gaskiya yau dariya nake sha a app nan   mukam na we be var
2488,allah yasa shi yasi xama alkairi gare ka
2489,allah ya kare  ya tsare mai girma gwamna
2490,wallahi ba za su kirgu ba  kuma na alkhairi  allah ka kara wa buhari lafiya da nisan kwana da imani
2491,babu abunda zai same mu sai abunda allah subhanahu wata ala ya rubuta zai auku damu   allah gamu gareka
2492,allah ya amsa addu ar mu alhamdulillah
2493,allah ya sakama sojojin nigeria da alheri ya kara tsare mana su
2494,allah yasa muna cikin masu parin ciki dunia da lahira
2495,nice   1 best actress inayin ki da fatan kina cikin film din saboda without you no sweet of watching film
2496,masha allah yayi dai dai  haka mukeso  allah yakara mana irinsu diyawa  muma allah ubangiji yabamu dukiya al barka muyi fiyeda wan nan
2497,allah kara lafiya
2498,allah yabaki lafya mamana  yasa kaffarece agareki     i really felt that which you re going through  may allah grant you quick recovery aameen
2499,allah yaji kansa babu ranar tsayar da lockdown kenan
2500,dan allah ka daina mana haka mun tuba
2501,a gaisheku bbc hausa da wannan nazari mai zurfi
2502,allah yajikan mallam  yakaramana hakurin rashin ka  kuma ya amfanan damu koyarwanka  yakai haske kabarinka
2503,innalillahi wa inna ilaihi raji un                          annabi saw  yake cewa idan dai har baku jin kunya  toh kuyi duk abunda kuka gadama  allah ka shiryemu da shiryuwa ka
2504,lol   to gskya ni ke kadae nake so
2505,mashaallah allah ya sanya alkairi yasa anyi kenan   allah kuma ya basu zaman lafiya
2506,glory be to allah 4 u rahama sadau na tau sa yamiki allah ni gun fans din ne
2507,allah ya karemu da karewarsa ya yaye mana wannan bala i dan alfarmar manzan allah s a w
2508,ameen summa ameen my jaruma
2509,masha allahu     waya gayamai zai taba dan gatan allah ya zauna lapiya  lmaoo
2510,zan roki allah  swa  ya duba halin da nigeria    take ciki ya kawo mana gyara dan rahamar sa     kafin komai ya biyo baya
2511,zamusha kallo allah yanuna mn lokacin rahma gsky kundace sai kace ma auratan gaske
2512,gsky malam aminu saira ko iya hk akatsaya film yayi ma ana domin bantaba ganin wanda yabirgeniba piyeda wannan musamman ma bayyanar sarkin waka allah yakara basira
2513,allah ya karemu da karewa su kuma allah ya kubutar dasu bisa ikon sa sukuma kidnappers din allah ya shiryasu ya ganar dasu hanya mai kyau
2514,tabarakallah masha allah  this my sister bata son yimun magana i don t why  am sorry if i sound rough to you
2515,shugabanni sukoyi yin adalci  rikon amana  hakuri  da sauraren koken talakawa da kuma yi masu hidima banda handama da babakere  allah ya gafarta wa mazan jiya sardauna  sir  ahmadu bello   sir  a
2516,allah yasa ya gurfannan  ai ba wanda yafi karfin doka amma bara kuga bazai je ba madadinsa za a tura
2517,bbchausa kuna burgeni
